hashtags,id,retweeted,coordinates,content,followers_count,score,location,retweet_count,listed_count,favorited,utc_offset,description,user_mentions,trackback_author_url,geo_enabled,geo,lang,favourites_count,firstpost_date,url,time_zone,place,trackback_author_nick,trackback_permalink
bleedingdisorders~HemoChat,478876215759998977,False,None,Join us &amp; @hemophiliafed on 6/25 at 1pm EST for our Twitter chat on #bleedingdisorders camp. Use #HemoChat to join in.,2773,10.478593,New York City,0,94,False,-14400,"NHF is dedicated to finding better treatments/cures for inheritable bleeding disorders & to preventing related complications via education, advocacy & research.",hemophiliafed,http://twitter.com/nhf_hemophilia,True,None,en,156,06/17/14,http://twitter.com/nhf_hemophilia/status/478876215759998977,Eastern Time (US & Canada),None,nhf_hemophilia,http://twitter.com/NHF_Hemophilia/status/478876215759998977
Hemophilia~bleedingdisorders,478889941926019073,False,None,"You only have until midnight to get a ""I Love Someone with #Hemophilia"" shirt. Don't miss out!: https://t.co/tR7prmM8R7 #bleedingdisorders",1764,8.051712,"Washington, DC",0,56,False,-14400,Hemophilia Federation of America is a national nonprofit organization that assists and advocates for the #bleedingdisorders community.,,http://twitter.com/hemophiliafed,True,None,en,834,06/17/14,http://twitter.com/hemophiliafed/status/478889941926019073,Eastern Time (US & Canada),None,hemophiliafed,http://twitter.com/hemophiliafed/status/478889941926019073
haemophilia~hemophilia~bleedingdisorders,478968911652999169,False,None,The Bleed ... Through the eyes of a child  #haemophilia #hemophilia #bleedingdisorders http://t.co/AIZz9Sd5qi,39,7.762975,London,0,1,False,None,An open-access journal for sharing experience in the care of people with bleeding disorders,,http://twitter.com/haemjournal,False,None,en,0,06/17/14,http://twitter.com/haemjournal/status/478968911652999169,None,None,haemjournal,http://twitter.com/haemjournal/status/478968911652999169
haemophilia~hemophilia~bleedingdisorders,478968912454111232,False,None,The Bleed ... Through the eyes of a child  #haemophilia #hemophilia #bleedingdisorders http://t.co/Bm73knLlUN,37,7.7857337,London,0,1,False,None,Haemnet is the network for health care professionals who treat people with inherited bleeding disorders.,,http://twitter.com/haemnet,False,None,en,0,06/17/14,http://twitter.com/haemnet/status/478968912454111232,None,None,haemnet,http://twitter.com/haemnet/status/478968912454111232
haemophilia~hemophilia~bleedingdisorders,478968913104220161,False,None,The Bleed ... Through the eyes of a child  #haemophilia #hemophilia #bleedingdisorders http://t.co/xDjFqWvWhM,141,8.56256,London,1,6,False,0,SixVibe is the online community for young people with bleeding disorders to learn from and connect with each other.,,http://twitter.com/sixvibe,False,None,en,4,06/17/14,http://twitter.com/sixvibe/status/478968913104220161,Casablanca,None,sixvibe,http://twitter.com/Sixvibe/status/478968913104220161
haemophilia~hemophilia~bleedingdisorders,478983335298236416,False,None,RT @Sixvibe: The Bleed ... Through the eyes of a child  #haemophilia #hemophilia #bleedingdisorders http://t.co/xDjFqWvWhM,71,7.521139,,1,0,False,None,,Sixvibe,http://twitter.com/katekhair,False,None,en,23,06/17/14,http://twitter.com/katekhair/status/478983335298236416,None,None,katekhair,http://twitter.com/katekhair/status/478983335298236416
bleedingdisorders,479029747058348032,False,None,This comedy show gave NHF a chance to raise its profile &amp; the work it does to support people w/ #bleedingdisorders: http://t.co/z7Bvk6Yaoa,2773,10.841918,New York City,0,94,False,-14400,"NHF is dedicated to finding better treatments/cures for inheritable bleeding disorders & to preventing related complications via education, advocacy & research.",,http://twitter.com/nhf_hemophilia,True,None,en,156,06/17/14,http://twitter.com/nhf_hemophilia/status/479029747058348032,Eastern Time (US & Canada),None,nhf_hemophilia,http://twitter.com/NHF_Hemophilia/status/479029747058348032
bleedingdisorders~takingittothestreets,479045182457790464,False,"{u'type': u'Point', u'coordinates': [-82.01003621, 39.96558659]}",Awesome Social Factor Night in Zanesville! Thank you @BioScripInc and @biogenidec #bleedingdisorders #takingittothestreets,393,7.3207445,"Columbus, OH",0,33,False,-14400,The Central Ohio Chapter of the National Hemophilia Foundation for all bleeding and clotting disorders,BioScripInc~biogenidec,http://twitter.com/cocofnhf,True,"{u'type': u'Point', u'coordinates': [39.96558659, -82.01003621]}",en,8,06/17/14,http://twitter.com/cocofnhf/status/479045182457790464,Eastern Time (US & Canada),"{u'country_code': u'US', u'url': u'https://api.twitter.com/1.1/geo/id/f4a27b9e3d616757.json', u'country': u'United States', u'place_type': u'city', u'bounding_box': {u'type': u'Polygon', u'coordinates': [[[-82.053673, 39.909178], [-81.977376, 39.909178], [-81.977376, 39.994063], [-82.053673, 39.994063]]]}, u'contained_within': [], u'full_name': u'Zanesville, OH', u'attributes': {}, u'id': u'f4a27b9e3d616757', u'name': u'Zanesville'}",cocofnhf,http://twitter.com/cocofnhf/status/479045182457790464
hemophilia~bleedingdisorders,479078302552834048,False,None,We only need to sell 46 more shirts to reach our goal! Help raise #hemophilia awareness w/a tee! https://t.co/tR7prmM8R7 #bleedingdisorders,1764,10.336613,"Washington, DC",4,56,False,-14400,Hemophilia Federation of America is a national nonprofit organization that assists and advocates for the #bleedingdisorders community.,,http://twitter.com/hemophiliafed,True,None,en,834,06/18/14,http://twitter.com/hemophiliafed/status/479078302552834048,Eastern Time (US & Canada),None,hemophiliafed,http://twitter.com/hemophiliafed/status/479078302552834048
hemophilia~bleedingdisorders,479079071234527232,False,None,RT @hemophiliafed: We only need to sell 46 more shirts to reach our goal! Help raise #hemophilia awareness w/a tee! https://t.co/tR7prmM8R7…,2946,7.45502,Los Angeles / NYC,4,174,False,-14400,Actor. Writer. Producer. Former Poker Pro. Hemophiliac & advocate. (Un)healthy obession w the NBA.,hemophiliafed,http://twitter.com/pjlynch,True,None,en,80578,06/18/14,http://twitter.com/pjlynch/status/479079071234527232,Eastern Time (US & Canada),None,pjlynch,http://twitter.com/pjlynch/status/479079071234527232
hemophilia~bleedingdisorders,479082165141917696,False,None,RT @hemophiliafed: We only need to sell 46 more shirts to reach our goal! Help raise #hemophilia awareness w/a tee! https://t.co/tR7prmM8R7…,47,7.45502,,4,3,False,-18000,,hemophiliafed,http://twitter.com/kimberly_hfa,False,None,en,7,06/18/14,http://twitter.com/kimberly_hfa/status/479082165141917696,Central Time (US & Canada),None,kimberly_hfa,http://twitter.com/Kimberly_HFA/status/479082165141917696
hemophilia~bleedingdisorders,479083670729261056,False,None,RT @hemophiliafed: We only need to sell 46 more shirts to reach our goal! Help raise #hemophilia awareness w/a tee! https://t.co/tR7prmM8R7…,30,7.45502,"Albuquerque, NM",4,1,False,None,To enhance the quality of life for people with rare bleeding disorders in the state of New Mexico.,hemophiliafed,http://twitter.com/sdonmbleeders,False,None,en,141,06/18/14,http://twitter.com/sdonmbleeders/status/479083670729261056,None,None,sdonmbleeders,http://twitter.com/SDONMbleeders/status/479083670729261056
Hemophilia~bleedingdisorders,479107604602699776,False,None,"Don't be Cinderella, get your I Love Someone With #Hemophilia shirt! Only 15 minutes left to buy! https://t.co/zoFEOBSV3v #bleedingdisorders",1764,7.9931316,"Washington, DC",0,56,False,-14400,Hemophilia Federation of America is a national nonprofit organization that assists and advocates for the #bleedingdisorders community.,,http://twitter.com/hemophiliafed,True,None,en,834,06/18/14,http://twitter.com/hemophiliafed/status/479107604602699776,Eastern Time (US & Canada),None,hemophiliafed,http://twitter.com/hemophiliafed/status/479107604602699776
women~bleedingdisorders,479146173799100416,False,None,@RoyalLpoolHosps This is absolutely amazing! Thank you so much for raising awareness about #women #bleedingdisorders. http://t.co/Ly6qnbejPH,1444,9.415335,United Kingdom,1,36,False,7200,"The only UK wide charity for all people affected by bleeding disorders. Providing information, support and advocacy.",RoyalLpoolHosps,http://twitter.com/haemosocuk,True,None,en,23,06/18/14,http://twitter.com/haemosocuk/status/479146173799100416,Amsterdam,None,haemosocuk,http://twitter.com/HaemoSocUK/status/479146173799100416
hemophilia~bleedingdisorders,479172967864479745,False,None,Successful use of BPL Factor X concentrate in a child with severe factor X deficiency #hemophilia #bleedingdisorders http://t.co/FvAyIbibMg,37,7.678116,London,0,1,False,None,Haemnet is the network for health care professionals who treat people with inherited bleeding disorders.,,http://twitter.com/haemnet,False,None,en,0,06/18/14,http://twitter.com/haemnet/status/479172967864479745,None,None,haemnet,http://twitter.com/haemnet/status/479172967864479745
hemophilia~bleedingdisorders,479172968250372096,False,None,Successful use of BPL Factor X concentrate in a child with severe factor X deficiency #hemophilia #bleedingdisorders http://t.co/8pRws2zsSk,39,7.612993,London,0,1,False,None,An open-access journal for sharing experience in the care of people with bleeding disorders,,http://twitter.com/haemjournal,False,None,en,0,06/18/14,http://twitter.com/haemjournal/status/479172968250372096,None,None,haemjournal,http://twitter.com/haemjournal/status/479172968250372096
women~bleedingdisorders,479179794165530624,False,None,RT @HaemoSocUK: @RoyalLpoolHosps This is absolutely amazing! Thank you so much for raising awareness about #women #bleedingdisorders. http:…,2646,7.6125326,"Liverpool, UK",1,17,False,3600,"We provide specialist, emergency and complex care for people across the region. The new Royal  will open in 2017.",HaemoSocUK~RoyalLpoolHosps,http://twitter.com/royallpoolhosps,True,None,en,290,06/18/14,http://twitter.com/royallpoolhosps/status/479179794165530624,London,None,royallpoolhosps,http://twitter.com/RoyalLpoolHosps/status/479179794165530624
TalkingRed~bleedingdisorders,479258284562849792,False,None,@LoisDowsett That's awesome!! Thank you so much for supporting #TalkingRed and raising awareness for womens #bleedingdisorders,1444,7.579289,United Kingdom,0,36,False,7200,"The only UK wide charity for all people affected by bleeding disorders. Providing information, support and advocacy.",LoisDowsett,http://twitter.com/haemosocuk,True,None,en,23,06/18/14,http://twitter.com/haemosocuk/status/479258284562849792,Amsterdam,None,haemosocuk,http://twitter.com/HaemoSocUK/status/479258284562849792
hemophilia~bleedingdisorders,479262568284844033,False,None,On Capitol Hill doing some advocacy work for the #hemophilia &amp; #bleedingdisorders community.,190,8.431766,"ÜT: 39.595418,-104.858162",1,7,False,-21600,"Mom, Wife, volunteer, program consultant @hemophiliafed",,http://twitter.com/sonjiwilkes,False,None,en,89,06/18/14,http://twitter.com/sonjiwilkes/status/479262568284844033,Mountain Time (US & Canada),None,sonjiwilkes,http://twitter.com/sonjiwilkes/status/479262568284844033
bleedingdisorders,479263175519789056,False,"{u'type': u'Point', u'coordinates': [-77.00571882, 38.8888277]}",Jeff is about to meet with @PattyMurray's office on patients' access to #bleedingdisorders treatment! http://t.co/xIpSWDBmrS,1764,9.493169,"Washington, DC",1,56,False,-14400,Hemophilia Federation of America is a national nonprofit organization that assists and advocates for the #bleedingdisorders community.,PattyMurray,http://twitter.com/hemophiliafed,True,"{u'type': u'Point', u'coordinates': [38.8888277, -77.00571882]}",en,834,06/18/14,http://twitter.com/hemophiliafed/status/479263175519789056,Eastern Time (US & Canada),"{u'country_code': u'US', u'url': u'https://api.twitter.com/1.1/geo/id/01fbe706f872cb32.json', u'country': u'United States', u'place_type': u'city', u'bounding_box': {u'type': u'Polygon', u'coordinates': [[[-77.119401, 38.801826], [-76.909396, 38.801826], [-76.909396, 38.99511], [-77.119401, 38.99511]]]}, u'contained_within': [], u'full_name': u'Washington, DC', u'attributes': {}, u'id': u'01fbe706f872cb32', u'name': u'Washington'}",hemophiliafed,http://twitter.com/hemophiliafed/status/479263175519789056
hemophilia~bleedingdisorders,479279836444524545,False,None,RT @sonjiwilkes: On Capitol Hill doing some advocacy work for the #hemophilia &amp; #bleedingdisorders community.,1764,7.3912416,"Washington, DC",1,56,False,-14400,Hemophilia Federation of America is a national nonprofit organization that assists and advocates for the #bleedingdisorders community.,sonjiwilkes,http://twitter.com/hemophiliafed,True,None,en,834,06/18/14,http://twitter.com/hemophiliafed/status/479279836444524545,Eastern Time (US & Canada),None,hemophiliafed,http://twitter.com/hemophiliafed/status/479279836444524545
TalkingRed~bleedingdisorders~PaintItRed,479291386639159296,False,None,@MarkeeB @LoisDowsett this is awesome! Thank you so much for supporting #TalkingRed and women with #bleedingdisorders #PaintItRed,1444,7.3053627,United Kingdom,0,36,False,7200,"The only UK wide charity for all people affected by bleeding disorders. Providing information, support and advocacy.",MarkeeB~LoisDowsett,http://twitter.com/haemosocuk,True,None,en,23,06/18/14,http://twitter.com/haemosocuk/status/479291386639159296,Amsterdam,None,haemosocuk,http://twitter.com/HaemoSocUK/status/479291386639159296
bleedingdisorders,479306028035481600,False,"{u'type': u'Point', u'coordinates': [-77.00958528, 38.88868516]}",John &amp; Michelle are all set to let @lisamurkowski know about the challenges facing the #bleedingdisorders community! http://t.co/Q2wh2Qo9dJ,1764,9.137287,"Washington, DC",1,56,False,-14400,Hemophilia Federation of America is a national nonprofit organization that assists and advocates for the #bleedingdisorders community.,lisamurkowski,http://twitter.com/hemophiliafed,True,"{u'type': u'Point', u'coordinates': [38.88868516, -77.00958528]}",en,834,06/18/14,http://twitter.com/hemophiliafed/status/479306028035481600,Eastern Time (US & Canada),"{u'country_code': u'US', u'url': u'https://api.twitter.com/1.1/geo/id/01fbe706f872cb32.json', u'country': u'United States', u'place_type': u'city', u'bounding_box': {u'type': u'Polygon', u'coordinates': [[[-77.119401, 38.801826], [-76.909396, 38.801826], [-76.909396, 38.99511], [-77.119401, 38.99511]]]}, u'contained_within': [], u'full_name': u'Washington, DC', u'attributes': {}, u'id': u'01fbe706f872cb32', u'name': u'Washington'}",hemophiliafed,http://twitter.com/hemophiliafed/status/479306028035481600
bleedingdisorders~advocacy,479329961291964416,False,None,Feeling inspired by patients stories and democracy in action @hemophiliafed hill day #bleedingdisorders #advocacy http://t.co/Am2UwmTBOd,32,7.575249,Beneath an Ithaca sunset,0,0,False,None,"investing in human spirit, before it's too late",hemophiliafed,http://twitter.com/oldlew,True,None,en,74,06/18/14,http://twitter.com/oldlew/status/479329961291964416,None,None,oldlew,http://twitter.com/oldlew/status/479329961291964416
beforethelaw~bleedingdisorders,479332290796204032,False,None,Hemophiliacs fighting the power #beforethelaw #bleedingdisorders hemophiliafed hill day http://t.co/kVXpEls2lt,32,7.4777784,Beneath an Ithaca sunset,0,0,False,None,"investing in human spirit, before it's too late",,http://twitter.com/oldlew,True,None,en,74,06/18/14,http://twitter.com/oldlew/status/479332290796204032,None,None,oldlew,http://twitter.com/oldlew/status/479332290796204032
haemophilia~hemophilia~bleedingdisorders,479334047756587008,False,None,Women with haemophilia: more than just carriers #haemophilia #hemophilia #bleedingdisorders http://t.co/WzIJrfgy6p,39,7.5113406,London,0,1,False,None,An open-access journal for sharing experience in the care of people with bleeding disorders,,http://twitter.com/haemjournal,False,None,en,0,06/18/14,http://twitter.com/haemjournal/status/479334047756587008,None,None,haemjournal,http://twitter.com/haemjournal/status/479334047756587008
haemophilia~hemophilia~bleedingdisorders,479334048628998144,False,None,Women with haemophilia: more than just carriers #haemophilia #hemophilia #bleedingdisorders http://t.co/Ww3Oxk3OUw,37,7.5425,London,0,1,False,None,Haemnet is the network for health care professionals who treat people with inherited bleeding disorders.,,http://twitter.com/haemnet,False,None,en,0,06/18/14,http://twitter.com/haemnet/status/479334048628998144,None,None,haemnet,http://twitter.com/haemnet/status/479334048628998144
haemophilia~hemophilia~bleedingdisorders,479334050008940545,False,None,Women with haemophilia: more than just carriers #haemophilia #hemophilia #bleedingdisorders http://t.co/Dz7i3QKi49,141,7.543497,London,0,6,False,0,SixVibe is the online community for young people with bleeding disorders to learn from and connect with each other.,,http://twitter.com/sixvibe,False,None,en,4,06/18/14,http://twitter.com/sixvibe/status/479334050008940545,Casablanca,None,sixvibe,http://twitter.com/Sixvibe/status/479334050008940545
bleedingdisorders~HemoChat,479344561890676736,False,None,Did your kid love #bleedingdisorders camp? Join us &amp; @hemophiliafed on 6/25 at 1pm EST and tell us why! Use #HemoChat to join in.,2773,10.374107,New York City,0,94,False,-14400,"NHF is dedicated to finding better treatments/cures for inheritable bleeding disorders & to preventing related complications via education, advocacy & research.",hemophiliafed,http://twitter.com/nhf_hemophilia,True,None,en,156,06/18/14,http://twitter.com/nhf_hemophilia/status/479344561890676736,Eastern Time (US & Canada),None,nhf_hemophilia,http://twitter.com/NHF_Hemophilia/status/479344561890676736
bleedingdisorders,479393404770459648,False,None,These games and tools were designed to test your understanding and expand your knowledge of #bleedingdisorders: http://t.co/69hQr9BVel,2773,11.3136635,New York City,0,94,False,-14400,"NHF is dedicated to finding better treatments/cures for inheritable bleeding disorders & to preventing related complications via education, advocacy & research.",,http://twitter.com/nhf_hemophilia,True,None,en,156,06/18/14,http://twitter.com/nhf_hemophilia/status/479393404770459648,Eastern Time (US & Canada),None,nhf_hemophilia,http://twitter.com/NHF_Hemophilia/status/479393404770459648
haemophilia~hemophilia~bleedingdisorders,479512677690408961,False,None,Physical function and quality of life in adolescents with haemophilia (SO-FIT study)  #haemophilia #hemophilia #bleedingdisorders...,141,7.173863,London,0,6,False,0,SixVibe is the online community for young people with bleeding disorders to learn from and connect with each other.,,http://twitter.com/sixvibe,False,None,en,4,06/19/14,http://twitter.com/sixvibe/status/479512677690408961,Casablanca,None,sixvibe,http://twitter.com/Sixvibe/status/479512677690408961
haemophilia~hemophilia~bleedingdisorders,479512682207666176,False,None,Physical function and quality of life in adolescents with haemophilia (SO-FIT study)  #haemophilia #hemophilia #bleedingdisorders...,39,7.165043,London,0,1,False,None,An open-access journal for sharing experience in the care of people with bleeding disorders,,http://twitter.com/haemjournal,False,None,en,0,06/19/14,http://twitter.com/haemjournal/status/479512682207666176,None,None,haemjournal,http://twitter.com/haemjournal/status/479512682207666176
haemophilia~hemophilia~bleedingdisorders,479512682270560256,False,None,Physical function and quality of life in adolescents with haemophilia (SO-FIT study)  #haemophilia #hemophilia #bleedingdisorders...,37,8.763837,London,1,1,False,None,Haemnet is the network for health care professionals who treat people with inherited bleeding disorders.,,http://twitter.com/haemnet,False,None,en,0,06/19/14,http://twitter.com/haemnet/status/479512682270560256,None,None,haemnet,http://twitter.com/haemnet/status/479512682270560256
haemophilia~hemophilia~bleedingdisorders,479609566267985920,False,None,RT @haemnet: Physical function and quality of life in adolescents with haemophilia (SO-FIT study)  #haemophilia #hemophilia #bleedingdisord…,1012,7.0503397,"Carrboro, NC",1,13,False,-14400,"ISTH, a leading international society, seeks to advance the understanding, prevention, diagnosis & treatment of thrombotic & bleeding disorders. Join us! #isth",haemnet,http://twitter.com/isth,False,None,en,171,06/19/14,http://twitter.com/isth/status/479609566267985920,Eastern Time (US & Canada),None,isth,http://twitter.com/isth/status/479609566267985920
bleedingdisorders~HemoChat,479661913597435904,False,None,Want to know more about #bleedingdisorders camp? Join us &amp; @hemophiliafed on 6/25 1pm EST to chat about camp.  #HemoChat,2773,11.0583725,New York City,1,94,False,-14400,"NHF is dedicated to finding better treatments/cures for inheritable bleeding disorders & to preventing related complications via education, advocacy & research.",hemophiliafed,http://twitter.com/nhf_hemophilia,True,None,en,156,06/19/14,http://twitter.com/nhf_hemophilia/status/479661913597435904,Eastern Time (US & Canada),None,nhf_hemophilia,http://twitter.com/NHF_Hemophilia/status/479661913597435904
haemophilia~hemophilia~bleedingdisorders,479695187011457024,False,None,Octapharma’s balanced portfolio built on a very special juice  #haemophilia #hemophilia #bleedingdisorders http://t.co/3IdEPj0DFL,39,8.710488,London,1,1,False,None,An open-access journal for sharing experience in the care of people with bleeding disorders,,http://twitter.com/haemjournal,False,None,en,0,06/19/14,http://twitter.com/haemjournal/status/479695187011457024,None,None,haemjournal,http://twitter.com/haemjournal/status/479695187011457024
haemophilia~hemophilia~bleedingdisorders,479695187204390912,False,None,Octapharma’s balanced portfolio built on a very special juice  #haemophilia #hemophilia #bleedingdisorders http://t.co/N1VS3O8X0k,37,7.1471066,London,0,1,False,None,Haemnet is the network for health care professionals who treat people with inherited bleeding disorders.,,http://twitter.com/haemnet,False,None,en,0,06/19/14,http://twitter.com/haemnet/status/479695187204390912,None,None,haemnet,http://twitter.com/haemnet/status/479695187204390912
haemophilia~hemophilia~bleedingdisorders,479695197677580289,False,None,Octapharma’s balanced portfolio built on a very special juice  #haemophilia #hemophilia #bleedingdisorders http://t.co/t8OUcuLuNM,141,8.010448,London,1,6,False,0,SixVibe is the online community for young people with bleeding disorders to learn from and connect with each other.,,http://twitter.com/sixvibe,False,None,en,4,06/19/14,http://twitter.com/sixvibe/status/479695197677580289,Casablanca,None,sixvibe,http://twitter.com/Sixvibe/status/479695197677580289
haemophilia~hemophilia~bleedingdisorders,479845747664621568,False,None,RT @haemjournal: Octapharma’s balanced portfolio built on a very special juice  #haemophilia #hemophilia #bleedingdisorders http://t.co/3Id…,71,6.987201,,1,0,False,None,,haemjournal,http://twitter.com/katekhair,False,None,en,23,06/20/14,http://twitter.com/katekhair/status/479845747664621568,None,None,katekhair,http://twitter.com/katekhair/status/479845747664621568
haemophilia~hemophilia~bleedingdisorders,479845779444875264,False,None,RT @Sixvibe: Octapharma’s balanced portfolio built on a very special juice  #haemophilia #hemophilia #bleedingdisorders http://t.co/t8OUcuL…,71,7.0543113,,1,0,False,None,,Sixvibe,http://twitter.com/katekhair,False,None,en,23,06/20/14,http://twitter.com/katekhair/status/479845779444875264,None,None,katekhair,http://twitter.com/katekhair/status/479845779444875264
haemophilia~hemophilia~bleedingdisorders,479875072707297280,False,None,Adherence to treatment in adolescents with haemophilia: a qualitative study  #haemophilia #hemophilia #bleedingdisorders...,141,8.8808,London,1,6,False,0,SixVibe is the online community for young people with bleeding disorders to learn from and connect with each other.,,http://twitter.com/sixvibe,False,None,en,4,06/20/14,http://twitter.com/sixvibe/status/479875072707297280,Casablanca,None,sixvibe,http://twitter.com/Sixvibe/status/479875072707297280
haemophilia~hemophilia~bleedingdisorders,479875073386766337,False,None,Adherence to treatment in adolescents with haemophilia: a qualitative study  #haemophilia #hemophilia #bleedingdisorders...,39,8.9539995,London,1,1,False,None,An open-access journal for sharing experience in the care of people with bleeding disorders,,http://twitter.com/haemjournal,False,None,en,0,06/20/14,http://twitter.com/haemjournal/status/479875073386766337,None,None,haemjournal,http://twitter.com/haemjournal/status/479875073386766337
haemophilia~hemophilia~bleedingdisorders,479875082781990912,False,None,Adherence to treatment in adolescents with haemophilia: a qualitative study  #haemophilia #hemophilia #bleedingdisorders...,37,8.957926,London,1,1,False,None,Haemnet is the network for health care professionals who treat people with inherited bleeding disorders.,,http://twitter.com/haemnet,False,None,en,0,06/20/14,http://twitter.com/haemnet/status/479875082781990912,None,None,haemnet,http://twitter.com/haemnet/status/479875082781990912
haemophilia~hemophilia~bleedingdisorders,479887680684449792,False,None,RT @Sixvibe: Adherence to treatment in adolescents with haemophilia: a qualitative study  #haemophilia #hemophilia #bleedingdisorders...,71,7.133503,,1,0,False,None,,Sixvibe,http://twitter.com/katekhair,False,None,en,23,06/20/14,http://twitter.com/katekhair/status/479887680684449792,None,None,katekhair,http://twitter.com/katekhair/status/479887680684449792
