hashtags,id,retweeted,coordinates,content,followers_count,score,location,retweet_count,listed_count,favorited,utc_offset,description,user_mentions,trackback_author_url,geo_enabled,geo,lang,favourites_count,firstpost_date,url,time_zone,place,trackback_author_nick,trackback_permalink
bleedingdisorders,476102910309179393,False,None,RT @cohemo: Backpacks &amp; Bleeders is doing it AGAIN! Father's Day hike THIS SATURDAY at Lookout Mountain #bleedingdisorders http://t.co/XOzf…,26,7.2303166,"Aurora, Colorado",2,3,False,-21600,We are the Rocky Mountain Region's leader in the treatment of bleeding and clotting disorders and pediatric stroke.,cohemo,http://twitter.com/htccolorado,False,None,en,5,06/09/14,http://twitter.com/htccolorado/status/476102910309179393,Mountain Time (US & Canada),None,htccolorado,http://twitter.com/HTCColorado/status/476102910309179393
bleedingdisorders~hemophilia,476146351550779392,False,None,Baxter recently presented an update on #bleedingdisorders therapies in its development pipeline: http://t.co/x0t6Ywcwog #hemophilia,2773,11.997495,New York City,2,94,False,-14400,"NHF is dedicated to finding better treatments/cures for inheritable bleeding disorders & to preventing related complications via education, advocacy & research.",,http://twitter.com/nhf_hemophilia,True,None,en,156,06/09/14,http://twitter.com/nhf_hemophilia/status/476146351550779392,Eastern Time (US & Canada),None,nhf_hemophilia,http://twitter.com/NHF_Hemophilia/status/476146351550779392
bleedingdisorders~hemophilia,476166637000073216,False,None,RT @NHF_Hemophilia: Baxter recently presented an update on #bleedingdisorders therapies in its development pipeline: http://t.co/x0t6Ywcwog…,30,7.42599,,2,1,False,None,"Celox works in seconds when help is minutes away. Safely stops the bleed in many situations. Great for people on blood thinners, hemophiliacs, and anyone else.",NHF_Hemophilia,http://twitter.com/celoxonline,False,None,en,28,06/10/14,http://twitter.com/celoxonline/status/476166637000073216,None,None,celoxonline,http://twitter.com/CeloxOnline/status/476166637000073216
Emory~meddev~bleedingdisorders,476414769683890176,False,None,#Emory #meddev helps study clot formation &amp; could be used to find cures for #bleedingdisorders @hemophiliafed http://t.co/N9okenZ1Yl,1346,8.731435,"Atlanta, GA",1,58,False,None,"Emory's Office of Technology Transfer... Your Gateway to Discovery, Products, & Innovation.",hemophiliafed,http://twitter.com/emoryott,False,None,en,1258,06/10/14,http://twitter.com/emoryott/status/476414769683890176,None,None,emoryott,http://twitter.com/EmoryOTT/status/476414769683890176
bleedingdisorders~hemophilia,476415483814486016,False,None,RT @NHF_Hemophilia: Baxter recently presented an update on #bleedingdisorders therapies in its development pipeline: http://t.co/x0t6Ywcwog…,32,7.42599,,2,0,False,-21600,"Partner and Consumer Advocate for Reliance Factor of Texas, LLC and Reliance Factor of New Mexico, LLC",NHF_Hemophilia,http://twitter.com/flgprohemo,False,None,en,46,06/10/14,http://twitter.com/flgprohemo/status/476415483814486016,Mountain Time (US & Canada),None,flgprohemo,http://twitter.com/FLGprohemo/status/476415483814486016
bleedingdisorders,476415769970896896,False,None,RT @cohemo: Backpacks &amp; Bleeders is doing it AGAIN! Father's Day hike THIS SATURDAY at Lookout Mountain #bleedingdisorders http://t.co/XOzf…,32,7.2303166,,2,0,False,-21600,"Partner and Consumer Advocate for Reliance Factor of Texas, LLC and Reliance Factor of New Mexico, LLC",cohemo,http://twitter.com/flgprohemo,False,None,en,46,06/10/14,http://twitter.com/flgprohemo/status/476415769970896896,Mountain Time (US & Canada),None,flgprohemo,http://twitter.com/FLGprohemo/status/476415769970896896
bleedingdisorders~hemophilia,476416294464401408,False,None,RT @hemophiliafed: Get a copy of a NEW book by dads in #bleedingdisorders #hemophilia community. Register to become a Dad in Action!: http:…,32,7.462011,,2,0,False,-21600,"Partner and Consumer Advocate for Reliance Factor of Texas, LLC and Reliance Factor of New Mexico, LLC",hemophiliafed,http://twitter.com/flgprohemo,False,None,en,46,06/10/14,http://twitter.com/flgprohemo/status/476416294464401408,Mountain Time (US & Canada),None,flgprohemo,http://twitter.com/FLGprohemo/status/476416294464401408
bleedingdisorders~HemoChat,476416690981335040,False,None,RT @NHF_Hemophilia: Been to #bleedingdisorders camp? Come chat about it! Join us &amp; @hemophiliafed on 6/25 at 1pm EST to talk all things cam…,32,6.9703264,,3,0,False,-21600,"Partner and Consumer Advocate for Reliance Factor of Texas, LLC and Reliance Factor of New Mexico, LLC",NHF_Hemophilia~hemophiliafed,http://twitter.com/flgprohemo,False,None,en,46,06/10/14,http://twitter.com/flgprohemo/status/476416690981335040,Mountain Time (US & Canada),None,flgprohemo,http://twitter.com/FLGprohemo/status/476416690981335040
hemophilia~bleedingdisorders,476417135166500864,False,None,RT @VAHemophilia: RSVP for our Educational Dinner This Thursday - Do Note New Location #hemophilia #bleedingdisorders http://t.co/Ck3WshSPeh,32,7.3351674,,1,0,False,-21600,"Partner and Consumer Advocate for Reliance Factor of Texas, LLC and Reliance Factor of New Mexico, LLC",VAHemophilia,http://twitter.com/flgprohemo,False,None,en,46,06/10/14,http://twitter.com/flgprohemo/status/476417135166500864,Mountain Time (US & Canada),None,flgprohemo,http://twitter.com/FLGprohemo/status/476417135166500864
Android~iPad~Kindle~bleedingdisorders,476418502991962112,False,None,"RT @NHF_Hemophilia: Do you own a tablet-- #Android, #iPad or #Kindle? Find out how to get free #bleedingdisorders news from HemAware: http:…",32,6.9390564,,3,0,False,-21600,"Partner and Consumer Advocate for Reliance Factor of Texas, LLC and Reliance Factor of New Mexico, LLC",NHF_Hemophilia,http://twitter.com/flgprohemo,False,None,en,46,06/10/14,http://twitter.com/flgprohemo/status/476418502991962112,Mountain Time (US & Canada),None,flgprohemo,http://twitter.com/FLGprohemo/status/476418502991962112
bleedingdisorders~hemophilia,476418779476267008,False,None,RT @NHF_Hemophilia: Have you seen our new website? Get updated #bleedingdisorders &amp; #hemophilia news and more: http://t.co/YdwmQF2iK1,32,7.2642865,,3,0,False,-21600,"Partner and Consumer Advocate for Reliance Factor of Texas, LLC and Reliance Factor of New Mexico, LLC",NHF_Hemophilia,http://twitter.com/flgprohemo,False,None,en,46,06/10/14,http://twitter.com/flgprohemo/status/476418779476267008,Mountain Time (US & Canada),None,flgprohemo,http://twitter.com/FLGprohemo/status/476418779476267008
hepatitisC~HCV~bleedingdisorders,476437021586882560,False,None,.@CMSGov announces @MedicareGov will cover screening for #hepatitisC: http://t.co/QIUJph815c #HCV #bleedingdisorders,2773,11.336177,New York City,1,94,False,-14400,"NHF is dedicated to finding better treatments/cures for inheritable bleeding disorders & to preventing related complications via education, advocacy & research.",CMSGov~MedicareGov,http://twitter.com/nhf_hemophilia,True,None,en,156,06/10/14,http://twitter.com/nhf_hemophilia/status/476437021586882560,Eastern Time (US & Canada),None,nhf_hemophilia,http://twitter.com/NHF_Hemophilia/status/476437021586882560
hepatitisC~HCV~bleedingdisorders,476455696826130432,False,None,RT @NHF_Hemophilia: .@CMSGov announces @MedicareGov will cover screening for #hepatitisC: http://t.co/QIUJph815c #HCV #bleedingdisorders,215,7.1782665,,1,5,False,None,"The FHA is dedicated to providing educational programs, emotional support and advocacy to individuals and families in FL affected by bleeding disorders.",NHF_Hemophilia~CMSGov~MedicareGov,http://twitter.com/flhemoassoc,False,None,en,11,06/10/14,http://twitter.com/flhemoassoc/status/476455696826130432,None,None,flhemoassoc,http://twitter.com/FLHemoAssoc/status/476455696826130432
clottingcascade~hemophilia~vonwillebranddisease~bleedingdisorders,476492765711183872,False,None,Check out this infographic on the #clottingcascade!  #hemophilia #vonwillebranddisease #bleedingdisorders... http://t.co/Qd06g6tJit,673,7.5425,Illinois,0,16,False,-18000,The Comprehensive Bleeding Disorders Center is a nonprofit organization serving those with congenital #bleedingdisorders throughout the Midwest.,,http://twitter.com/compbleed,False,None,en,1168,06/10/14,http://twitter.com/compbleed/status/476492765711183872,Central Time (US & Canada),None,compbleed,http://twitter.com/CompBleed/status/476492765711183872
path2cures~bleedingdisorders~hemophilia,476726879735382017,False,None,@ECcures #path2cures health subcommittee development incentives hearing representing #bleedingdisorders #hemophilia @hemophiliafed,32,7.0931044,Beneath an Ithaca sunset,0,0,False,None,"investing in human spirit, before it's too late",ECcures~hemophiliafed,http://twitter.com/oldlew,True,None,en,74,06/11/14,http://twitter.com/oldlew/status/476726879735382017,None,None,oldlew,http://twitter.com/oldlew/status/476726879735382017
bleedingdisorders~HemoChat,476755246765441025,False,None,Did your kid love #bleedingdisorders camp? Join us &amp; @hemophiliafed on 6/25 at 1pm EST to tell us why! Use #HemoChat to join in.,2773,11.750012,New York City,3,94,False,-14400,"NHF is dedicated to finding better treatments/cures for inheritable bleeding disorders & to preventing related complications via education, advocacy & research.",hemophiliafed,http://twitter.com/nhf_hemophilia,True,None,en,156,06/11/14,http://twitter.com/nhf_hemophilia/status/476755246765441025,Eastern Time (US & Canada),None,nhf_hemophilia,http://twitter.com/NHF_Hemophilia/status/476755246765441025
bleedingdisorders~HemoChat,476755488307027972,False,None,RT @NHF_Hemophilia: Did your kid love #bleedingdisorders camp? Join us &amp; @hemophiliafed on 6/25 at 1pm EST to tell us why! Use #HemoChat to…,1764,6.9262214,"Washington, DC",3,56,False,-14400,Hemophilia Federation of America is a national nonprofit organization that assists and advocates for the #bleedingdisorders community.,NHF_Hemophilia~hemophiliafed,http://twitter.com/hemophiliafed,True,None,en,834,06/11/14,http://twitter.com/hemophiliafed/status/476755488307027972,Eastern Time (US & Canada),None,hemophiliafed,http://twitter.com/hemophiliafed/status/476755488307027972
TriviaNight~NYC~bleedingdisorders,476766449177210883,False,None,Are you a trivia hound? Join us at a #TriviaNight in #NYC on 6/18 at @SocialBarLounge! #bleedingdisorders http://t.co/J5N0P403Yz,2773,11.784618,New York City,2,94,False,-14400,"NHF is dedicated to finding better treatments/cures for inheritable bleeding disorders & to preventing related complications via education, advocacy & research.",SocialBarLounge,http://twitter.com/nhf_hemophilia,True,None,en,156,06/11/14,http://twitter.com/nhf_hemophilia/status/476766449177210883,Eastern Time (US & Canada),None,nhf_hemophilia,http://twitter.com/NHF_Hemophilia/status/476766449177210883
bleedingdisorders~HemoChat,476812214939041792,False,None,RT @NHF_Hemophilia: Did your kid love #bleedingdisorders camp? Join us &amp; @hemophiliafed on 6/25 at 1pm EST to tell us why! Use #HemoChat to…,30,6.9262214,,3,1,False,-18000,"Loves hemostasis, clot-busting, long walks on the beach and a good party!",NHF_Hemophilia~hemophiliafed,http://twitter.com/coagchimp,False,None,en,17,06/11/14,http://twitter.com/coagchimp/status/476812214939041792,Central Time (US & Canada),None,coagchimp,http://twitter.com/CoagChimp/status/476812214939041792
bleedingdisorders~HemoChat,476814463707148290,False,None,RT @NHF_Hemophilia: Did your kid love #bleedingdisorders camp? Join us &amp; @hemophiliafed on 6/25 at 1pm EST to tell us why! Use #HemoChat to…,9,6.9262214,,3,0,False,None,,NHF_Hemophilia~hemophiliafed,http://twitter.com/criddlechristy,False,None,en,57,06/11/14,http://twitter.com/criddlechristy/status/476814463707148290,None,None,criddlechristy,http://twitter.com/CriddleChristy/status/476814463707148290
clinicaltrial~bleedingdisorders~HCV,476848742847741952,False,None,This #clinicaltrial is recruiting people w/ inherited #bleedingdisorders &amp; chronic #HCV infection. Learn more: http://t.co/6V1iDcxXP1,2773,10.687939,New York City,1,94,False,-14400,"NHF is dedicated to finding better treatments/cures for inheritable bleeding disorders & to preventing related complications via education, advocacy & research.",,http://twitter.com/nhf_hemophilia,True,None,en,156,06/11/14,http://twitter.com/nhf_hemophilia/status/476848742847741952,Eastern Time (US & Canada),None,nhf_hemophilia,http://twitter.com/NHF_Hemophilia/status/476848742847741952
bleedingdisorders,476876601309675520,False,None,Have you heard? We gram! Follow us on Instagram @hemophiliafed to stay connected to #bleedingdisorders community! http://t.co/gwWKYNUYR0,1764,7.462011,"Washington, DC",0,56,False,-14400,Hemophilia Federation of America is a national nonprofit organization that assists and advocates for the #bleedingdisorders community.,hemophiliafed,http://twitter.com/hemophiliafed,True,None,en,834,06/12/14,http://twitter.com/hemophiliafed/status/476876601309675520,Eastern Time (US & Canada),None,hemophiliafed,http://twitter.com/hemophiliafed/status/476876601309675520
TriviaNight~NYC~bleedingdisorders,476897367006777344,False,None,RT @NHF_Hemophilia: Are you a trivia hound? Join us at a #TriviaNight in #NYC on 6/18 at @SocialBarLounge! #bleedingdisorders http://t.co/J…,390,7.1380706,Worldwide,2,12,False,None,MBB was the first hemophilia social network. As Facebook emerged as the leading choice we moved to Fb and Twitter. This account is managed by @davidmoore411,NHF_Hemophilia~SocialBarLounge,http://twitter.com/mybloodbrothers,False,None,en,46,06/12/14,http://twitter.com/mybloodbrothers/status/476897367006777344,None,None,mybloodbrothers,http://twitter.com/mybloodbrothers/status/476897367006777344
nurse~bleedingdisorders,477060391177310208,False,None,Are you a #nurse who treats people w/ #bleedingdisorders? Check out the updated Nurses’ Guide to Bleeding Disorders: http://t.co/4mZpSyH58q,2773,10.811905,New York City,0,94,False,-14400,"NHF is dedicated to finding better treatments/cures for inheritable bleeding disorders & to preventing related complications via education, advocacy & research.",,http://twitter.com/nhf_hemophilia,True,None,en,156,06/12/14,http://twitter.com/nhf_hemophilia/status/477060391177310208,Eastern Time (US & Canada),None,nhf_hemophilia,http://twitter.com/NHF_Hemophilia/status/477060391177310208
bleedingdisorders~hemophilia,477107806068146176,False,None,"Finding veins are not easy, esp for kids. Infusion tips &amp; tricks by #bleedingdisorders #hemophilia families to help: http://t.co/vLQsrDTBaN",1764,11.638251,"Washington, DC",2,56,False,-14400,Hemophilia Federation of America is a national nonprofit organization that assists and advocates for the #bleedingdisorders community.,,http://twitter.com/hemophiliafed,True,None,en,834,06/12/14,http://twitter.com/hemophiliafed/status/477107806068146176,Eastern Time (US & Canada),None,hemophiliafed,http://twitter.com/hemophiliafed/status/477107806068146176
bleedingdisorders~hemophilia,477110311665692672,False,None,"RT @hemophiliafed: Finding veins are not easy, esp for kids. Infusion tips &amp; tricks by #bleedingdisorders #hemophilia families to help: htt…",1887,10.384083,California,2,38,False,-25200,"The love of my life Bill Murphy Co-Developer & PR for DreamNET, see: http://t.co/G6m0Dx2Mh3. Also support @uneedpsi & Hemophiliacs of America",hemophiliafed,http://twitter.com/blondeone38,True,None,en,5578,06/12/14,http://twitter.com/blondeone38/status/477110311665692672,Pacific Time (US & Canada),None,blondeone38,http://twitter.com/Blondeone38/status/477110311665692672
awareness~bleedingdisorders,477205967000457217,False,None,@nikala Thanks so much for the RT and spreading #awareness for #bleedingdisorders!,76,7.906321,"Denver, Colorado",0,2,False,None,Blogger. Bleeder. Junior. CO❤️ Roll Tide.,nikala,http://twitter.com/baccei_keira,False,None,en,228,06/12/14,http://twitter.com/baccei_keira/status/477205967000457217,None,None,baccei_keira,http://twitter.com/baccei_keira/status/477205967000457217
CampHemotion~hemophilia~bleedingdisorders,477311185142824961,False,None,"Alright folks, we are just a few days away from our 37th year of #CampHemotion. See you there! #hemophilia #bleedingdisorders",225,7.5111513,"Emeryville, CA",0,2,False,-25200,"Hemophilia Foundation of Northern California - non-profit, volunteer-run organization serving the needs of people with hemophilia and related bleeding disorders",,http://twitter.com/hemofoundation,False,None,en,43,06/13/14,http://twitter.com/hemofoundation/status/477311185142824961,Pacific Time (US & Canada),None,hemofoundation,http://twitter.com/HemoFoundation/status/477311185142824961
vonWillebrandDisease~bleedingdisorders,477467162240487424,False,None,RT @WeBleedOnline: WEBLEED REPORT--&gt;University of Oregon senior Rick Lindfors explains life w/ #vonWillebrandDisease. #bleedingdisorders ht…,19,6.9789157,,1,0,False,None,,WeBleedOnline,http://twitter.com/susanq75,False,None,en,7,06/13/14,http://twitter.com/susanq75/status/477467162240487424,None,None,susanq75,http://twitter.com/SusanQ75/status/477467162240487424
bleedingdisorders~CWS,477470322166616064,False,None,Walgreens is proud to support #bleedingdisorders patients in their homes and on the field. #CWS @NHF_Hemophilia,5681,7.7416873,"Deerfield, Ill.",0,140,False,-18000,"Company & industry news covering beauty,health, and digital. Tweets by our communications team. Reach us here or media@walgreens.com",NHF_Hemophilia,http://twitter.com/walgreensnews,False,None,en,110,06/13/14,http://twitter.com/walgreensnews/status/477470322166616064,Central Time (US & Canada),None,walgreensnews,http://twitter.com/WalgreensNews/status/477470322166616064
TriviaNight~NYC~bleedingdisorders,477514431748792320,False,None,RT @NHF_Hemophilia: Are you a trivia hound? Join us at a #TriviaNight in #NYC on 6/18 at @SocialBarLounge! #bleedingdisorders http://t.co/J…,3572,10.393696,"Brooklyn, NY",2,96,False,-14400,"Creators of corporate trivia events | Producers of NYC's biggest trivia nights @BellHouseNY w/ @PatKiernan | Tweeters of trivia, cultural commentary & bad puns",NHF_Hemophilia~SocialBarLounge,http://twitter.com/trivworks,False,None,en,7545,06/13/14,http://twitter.com/trivworks/status/477514431748792320,Eastern Time (US & Canada),None,trivworks,http://twitter.com/TrivWorks/status/477514431748792320
bleedingdisorders~tongue~BracesProbs,477528089744793600,False,None,I just realized my tongue is bleeding. #bleedingdisorders #tongue #BracesProbs,816,7.926812,,0,1,False,None,Yawn.,,http://twitter.com/cyaneyes786,True,None,en,1070,06/13/14,http://twitter.com/cyaneyes786/status/477528089744793600,None,None,cyaneyes786,http://twitter.com/Cyaneyes786/status/477528089744793600
bleedingdisorders~HemoChat,477648416793579523,False,None,Want to know more about #bleedingdisorders camp? Join us &amp; @hemophiliafed on 6/25 1pm EST &amp; chat about camp. Share your story! #HemoChat,2773,10.244775,New York City,0,94,False,-14400,"NHF is dedicated to finding better treatments/cures for inheritable bleeding disorders & to preventing related complications via education, advocacy & research.",hemophiliafed,http://twitter.com/nhf_hemophilia,True,None,en,156,06/14/14,http://twitter.com/nhf_hemophilia/status/477648416793579523,Eastern Time (US & Canada),None,nhf_hemophilia,http://twitter.com/NHF_Hemophilia/status/477648416793579523
bleedingdisorders~CWS,477726208260849666,False,None,@WalgreensNews: Walgreens is proud to support #bleedingdisorders patients in their homes and on the field. #CWS @NHF_Hemophilia,6,7.4273286,21-23 Stanhope St Boston USA,0,0,False,-10800,"The ‘Community, A Walgreen Pharmacy’ stores, are specialty pharmacies located in the neighborhoods of their patients and physicians.",WalgreensNews~NHF_Hemophilia,http://twitter.com/walgreensboston,False,None,en,1,06/14/14,http://twitter.com/walgreensboston/status/477726208260849666,Atlantic Time (Canada),None,walgreensboston,http://twitter.com/WalgreensBoston/status/477726208260849666
bleedingdisorders,478271939472261120,False,None,@HaemoSocUK Red nails &amp; red top ready for work tomorrow. Ask me why I'm wearing red! #bleedingdisorders,34,9.164997,,1,0,False,None,,HaemoSocUK,http://twitter.com/ciara_a_young,True,None,en,66,06/15/14,http://twitter.com/ciara_a_young/status/478271939472261120,None,None,ciara_a_young,http://twitter.com/Ciara_A_Young/status/478271939472261120
bleedingdisorders,478369004374212609,False,None,Dads! Get a copy of a NEW &amp; FREE book by dads in #bleedingdisorders community. Register to become a Dad in Action: http://t.co/tU9l2P7ueX,1764,7.5619197,"Washington, DC",0,56,False,-14400,Hemophilia Federation of America is a national nonprofit organization that assists and advocates for the #bleedingdisorders community.,,http://twitter.com/hemophiliafed,True,None,en,834,06/16/14,http://twitter.com/hemophiliafed/status/478369004374212609,Eastern Time (US & Canada),None,hemophiliafed,http://twitter.com/hemophiliafed/status/478369004374212609
hemophilia~bleedingdisorders,478431087006588928,False,None,Share experience in #hemophilia and #bleedingdisorders at@haemjournal. Second issue now online.,39,7.734199,London,0,1,False,None,An open-access journal for sharing experience in the care of people with bleeding disorders,,http://twitter.com/haemjournal,False,None,en,0,06/16/14,http://twitter.com/haemjournal/status/478431087006588928,None,None,haemjournal,http://twitter.com/haemjournal/status/478431087006588928
hemophilia~bleedingdisorders,478431087602188288,False,None,Share experience in #hemophilia and #bleedingdisorders at@haemjournal. Second issue now online.,37,7.6668987,London,0,1,False,None,Haemnet is the network for health care professionals who treat people with inherited bleeding disorders.,,http://twitter.com/haemnet,False,None,en,0,06/16/14,http://twitter.com/haemnet/status/478431087602188288,None,None,haemnet,http://twitter.com/haemnet/status/478431087602188288
hemophilia~bleedingdisorders,478431088323596289,False,None,Share experience in #hemophilia and #bleedingdisorders at@haemjournal. Second issue now online.,141,7.736565,London,0,6,False,0,SixVibe is the online community for young people with bleeding disorders to learn from and connect with each other.,,http://twitter.com/sixvibe,False,None,en,4,06/16/14,http://twitter.com/sixvibe/status/478431088323596289,Casablanca,None,sixvibe,http://twitter.com/Sixvibe/status/478431088323596289
bleedingdisorders,478445853951414272,False,None,RT @Ciara_A_Young: @HaemoSocUK Red nails &amp; red top ready for work tomorrow. Ask me why I'm wearing red! #bleedingdisorders,1444,7.336506,United Kingdom,1,36,False,7200,"The only UK wide charity for all people affected by bleeding disorders. Providing information, support and advocacy.",Ciara_A_Young~HaemoSocUK,http://twitter.com/haemosocuk,True,None,en,23,06/16/14,http://twitter.com/haemosocuk/status/478445853951414272,Amsterdam,None,haemosocuk,http://twitter.com/HaemoSocUK/status/478445853951414272
bleedingdisorders,478570237374521344,False,None,@laurenlaverne please RT and help @HaemoSocUK raise awareness for women with #bleedingdisorders. Join our campaign http://t.co/COuStaN1wg,1444,7.7300086,United Kingdom,0,36,False,7200,"The only UK wide charity for all people affected by bleeding disorders. Providing information, support and advocacy.",laurenlaverne~HaemoSocUK,http://twitter.com/haemosocuk,True,None,en,23,06/16/14,http://twitter.com/haemosocuk/status/478570237374521344,Amsterdam,None,haemosocuk,http://twitter.com/HaemoSocUK/status/478570237374521344
bleedingdisorders,478570416571940866,False,None,@AnnieLennox please RT and help @HaemoSocUK raise awareness for women with #bleedingdisorders. Join our campaign http://t.co/COuStaN1wg,1444,7.6777205,United Kingdom,0,36,False,7200,"The only UK wide charity for all people affected by bleeding disorders. Providing information, support and advocacy.",AnnieLennox~HaemoSocUK,http://twitter.com/haemosocuk,True,None,en,23,06/16/14,http://twitter.com/haemosocuk/status/478570416571940866,Amsterdam,None,haemosocuk,http://twitter.com/HaemoSocUK/status/478570416571940866
bleedingdisorders,478570755123609600,False,None,@JessieJ please RT and help @HaemoSocUK raise awareness for women with #bleedingdisorders. Join our campaign http://t.co/Ly6qnbejPH,1444,7.788935,United Kingdom,0,36,False,7200,"The only UK wide charity for all people affected by bleeding disorders. Providing information, support and advocacy.",JessieJ~HaemoSocUK,http://twitter.com/haemosocuk,True,None,en,23,06/16/14,http://twitter.com/haemosocuk/status/478570755123609600,Amsterdam,None,haemosocuk,http://twitter.com/HaemoSocUK/status/478570755123609600
bleedingdisorders,478570894642921472,False,None,@Maryportas please RT and help @HaemoSocUK raise awareness for women with #bleedingdisorders. Join our campaign http://t.co/Ly6qnbejPH,1444,7.711292,United Kingdom,0,36,False,7200,"The only UK wide charity for all people affected by bleeding disorders. Providing information, support and advocacy.",maryportas~HaemoSocUK,http://twitter.com/haemosocuk,True,None,en,23,06/16/14,http://twitter.com/haemosocuk/status/478570894642921472,Amsterdam,None,haemosocuk,http://twitter.com/HaemoSocUK/status/478570894642921472
bleedingdisorders,478571061999828992,False,None,@pixiedoctor please RT and help @HaemoSocUK raise awareness for women with #bleedingdisorders. Join our campaign http://t.co/Ly6qnbejPH,1444,11.484572,United Kingdom,2,36,False,7200,"The only UK wide charity for all people affected by bleeding disorders. Providing information, support and advocacy.",pixiedoctor~HaemoSocUK,http://twitter.com/haemosocuk,True,None,en,23,06/16/14,http://twitter.com/haemosocuk/status/478571061999828992,Amsterdam,None,haemosocuk,http://twitter.com/HaemoSocUK/status/478571061999828992
