user_lang,user_description,hashtags,user_time_zone_placename,user_friends_count,user_utc_offset,id,sentiment,user_screen_name,user_location,user_favourites_count,user_verified,content,score,tweet_favorite_count,user_name,tweet_retweet_count,user_followers_count,user_time_zone_coordinates,user_mentions,trackback_author_url,short_file_name,user_location_coordinates,file_counter,tweet_geo,firstpost_date,user_listed_count,url,tweet_retweeted,user_geo_enabled,user_time_zone,tweet_favorited,user_location_placename,trackback_author_nick,tweet_place,trackback_permalink,tweet_coordinates,tweet_in_reply_to_screen_name,user_statuses_count,tweet_timestamp
en,"Information and inspiration for people living with CML. Margaret Dyer is an independent content manager for ARIAD Pharmaceuticals, sponsor of ReNEW.",bloodcancer,,309,None,464147951427010560,4,renewcml,,1,False,@LLSusa hits a big milestone in their support for the fight against #bloodcancer: Over $1BIL to help find a cure! http://t.co/ZjkUl5VMkH,11.522482,1,ReNEW CML,1,658,,LLSusa,http://twitter.com/renewcml,Jan to May\Blood\Tweets_BloodCancer.csv,,2,None,05/07/14,10,http://twitter.com/renewcml/status/464147951427010560,False,False,None,False,,renewcml,None,http://twitter.com/renewcml/status/464147951427010560,None,LLSusa,911,1399435200.0
en,,bloodcancer,,17,None,464173717107798017,4,jenproper,"Erie, PA",4,False,RT @Butchandkathy: Help spread the word! Fighting against #bloodcancer on May 16 @WWGolfClub. Learn how to you help http://t.co/H8OoyT8JHT …,7.141201,0,Jen Proper,4,7,,Butchandkathy~WWGolfClub~4thangelprogram,http://twitter.com/jenproper,Jan to May\Blood\Tweets_BloodCancer.csv,"(42.12922409999999, -80.085059)",2,None,05/07/14,0,http://twitter.com/jenproper/status/464173717107798017,False,False,None,False,"Erie, PA, USA",jenproper,None,http://twitter.com/jenproper/status/464173717107798017,None,None,6,1399435200.0
en,"Working Mom of 2 boys, Top 25 NY Mom, Literacy Specialist Grades 5-12, Family/Lifestyle Blogger, Survivor, Latina and Juggler Extraordinaire!",bloodcancer,United States,6782,-14400,464261092693127169,4,ToughCookieMom,"Bronx, New York",875,False,RT @renewcml: @LLSusa hits a big milestone in their support for the fight against #bloodcancer: Over $1BIL to help find a cure! http://t.co…,10.62891,0,Maria Castro,1,9278,"(37.09024, -95.712891)",renewcml~LLSusa,http://twitter.com/toughcookiemom,Jan to May\Blood\Tweets_BloodCancer.csv,"(40.8447819, -73.8648268)",2,None,05/08/14,255,http://twitter.com/toughcookiemom/status/464261092693127169,False,True,Eastern Time (US & Canada),False,"Bronx, NY, USA",toughcookiemom,None,http://twitter.com/ToughCookieMom/status/464261092693127169,None,None,45943,1399521600.0
en-gb,"Indian, CA in making, Fan of @narendramodi, Nation First and hates AAP",BloodCancer~Cancer,"Mumbai, Maharashtra, India",549,19800,464307463039111168,2,Rahulpawar4U,Nashik,420,False,Plz guys help this angel  #BloodCancer #Cancer http://t.co/ROHgZkZh9M,8.517434,1,Raahul Pawar ,0,128,"(19.0759837, 72.8776559)",,http://twitter.com/rahulpawar4u,Jan to May\Blood\Tweets_BloodCancer.csv,"(19.9974533, 73.78980229999999)",2,None,05/08/14,1,http://twitter.com/rahulpawar4u/status/464307463039111168,False,False,Mumbai,False,"Nashik, Maharashtra, India",rahulpawar4u,None,http://twitter.com/Rahulpawar4U/status/464307463039111168,None,None,5132,1399521600.0
es,Bringing life to Health in the Social Media world at @Ideagoras.,cancer~BloodCancer,"Madrid, Madrid, Spain",392,7200,464333587802619904,0,bbarrero,Madrid,192,False,Is this the way we will cure #cancer? http://t.co/goZDKv5Vh5 #BloodCancer,9.246081,1,Bartolomé Barrero,2,298,"(40.4167754, -3.7037902)",,http://twitter.com/bbarrero,Jan to May\Blood\Tweets_BloodCancer.csv,"(40.4167754, -3.7037902)",2,None,05/08/14,18,http://twitter.com/bbarrero/status/464333587802619904,False,False,Madrid,False,"Madrid, Madrid, Spain",bbarrero,None,http://twitter.com/bbarrero/status/464333587802619904,None,None,3351,1399521600.0
en,"Urban Fantasy Author, THE LIGHT WHO SHINES
#UrbanFantasy #Vampires #Paranormal #Romance #Mystery
Love to RT! Please return the favor. https://t.co/iT4KI4m2e7",cancer~BloodCancer,United States,5285,-14400,464336221494599680,0,Lilo_Abernathy,Smoky Mountains,2851,False,RT @bbarrero: Is this the way we will cure #cancer? http://t.co/goZDKv5Vh5 #BloodCancer,7.7080336,0,Lilo J Abernathy,2,5198,"(37.09024, -95.712891)",bbarrero,http://twitter.com/lilo_abernathy,Jan to May\Blood\Tweets_BloodCancer.csv,"(35.525521, -83.52630599999999)",2,None,05/08/14,146,http://twitter.com/lilo_abernathy/status/464336221494599680,False,False,Eastern Time (US & Canada),False,"Smoky Mountains, Great Smoky Mountains National Park, Forneys Creek, NC 28713, USA",lilo_abernathy,None,http://twitter.com/Lilo_Abernathy/status/464336221494599680,None,None,44799,1399521600.0
it,"Italian living in Oxford, communications professional, interested in healthcare and all good things in life.",cancer~BloodCancer,Greenland,972,-7200,464336603000098816,0,ScaClaudia,,117,False,RT @bbarrero: Is this the way we will cure #cancer? http://t.co/goZDKv5Vh5 #BloodCancer,7.7080336,0,Claudia Scarpelli,2,308,"(71.706936, -42.604303)",bbarrero,http://twitter.com/scaclaudia,Jan to May\Blood\Tweets_BloodCancer.csv,,2,None,05/08/14,8,http://twitter.com/scaclaudia/status/464336603000098816,False,True,Greenland,False,,scaclaudia,None,http://twitter.com/ScaClaudia/status/464336603000098816,None,None,657,1399521600.0
en,"I'm here on this planet to make your painting! Commissioned #artist, motivational live painter & manifesting diva. Let's Collaborate with Music, Art & Ideas",LLS~bloodcancer,,3093,-21600,464399404556763137,0,LaurieMavesArt,Denver,1196,False,@9NEWS turn on the tele this morning for #LLS #bloodcancer awareness,11.219316,1,Laurie Maves ART,0,2978,,9NEWS,http://twitter.com/lauriemavesart,Jan to May\Blood\Tweets_BloodCancer.csv,,2,None,05/08/14,135,http://twitter.com/lauriemavesart/status/464399404556763137,False,False,Mountain Time (US & Canada),False,,lauriemavesart,None,http://twitter.com/LaurieMavesArt/status/464399404556763137,None,9NEWS,16407,1399521600.0
en,is dedicated to improving patient care in diseases mediated by immune cells. Our ClonoSIGHT™ test for MRD in lymphoid cancers launched in 2013.,bloodcancer,,350,-25200,464435134037782528,0,SequentaInc,,0,False,BBMT study (@HemeDoc et al) shows ClonoSIGHT test predicts post-transplant relapse/survival in adult ALL http://t.co/Oy9qTuU5Ud #bloodcancer,6.8923106,1,Sequenta Inc. ,0,188,,hemedoc,http://twitter.com/sequentainc,Jan to May\Blood\Tweets_BloodCancer.csv,,2,None,05/08/14,17,http://twitter.com/sequentainc/status/464435134037782528,False,False,Arizona,False,,sequentainc,None,http://twitter.com/SequentaInc/status/464435134037782528,None,None,215,1399521600.0
en,"We are dedicated to ensuring that anyone affected by blood cancer receives the right information, advice & support. Call the Care Line for support 08088 010 444",Perth~scotland~bloodcancer~leukaemia,,1273,3600,464453548034756608,0,LeukaemiaCAREuk,UK,799,False,Book now for our #Perth patient &amp; carer conference on 21st June http://t.co/Nl6XYQaPXM #scotland #bloodcancer #leukaemia,11.583965,1,Leukaemia CARE,2,1872,,,http://twitter.com/leukaemiacareuk,Jan to May\Blood\Tweets_BloodCancer.csv,,2,None,05/08/14,42,http://twitter.com/leukaemiacareuk/status/464453548034756608,False,False,Dublin,False,,leukaemiacareuk,None,http://twitter.com/LeukaemiaCAREuk/status/464453548034756608,None,None,3754,1399521600.0
en,working for the national charity Leukaemia CARE,Perth~scotland~bloodcancer~leukaemia,,146,None,464455495500451841,0,nbate73,,11,False,RT @LeukaemiaCAREuk: Book now for our #Perth patient &amp; carer conference on 21st June http://t.co/Nl6XYQaPXM #scotland #bloodcancer #leukaem…,7.1112757,0,Nickey Bate,2,54,,LeukaemiaCAREuk,http://twitter.com/nbate73,Jan to May\Blood\Tweets_BloodCancer.csv,,2,None,05/08/14,1,http://twitter.com/nbate73/status/464455495500451841,False,False,None,False,,nbate73,None,http://twitter.com/nbate73/status/464455495500451841,None,None,198,1399521600.0
en,Global biopharmaceutical company. Tweets by Greg Geissman & Julissa Viana. Review our guidelines: http://t.co/dQFG8gzYVm,myeloma~bloodcancer,,626,-14400,464457390470213633,0,Celgene,"Summit, NJ",118,False,"Have you heard of multiple #myeloma?  About 81,000 Americans have this #bloodcancer - visit YouTube to learn more http://t.co/hGYDwJRokl",9.245092,2,Celgene Corporation,2,2039,,,http://twitter.com/celgene,Jan to May\Blood\Tweets_BloodCancer.csv,,2,None,05/08/14,50,http://twitter.com/celgene/status/464457390470213633,False,False,Eastern Time (US & Canada),False,,celgene,None,http://twitter.com/Celgene/status/464457390470213633,None,None,732,1399521600.0
en,,myeloma~bloodcancer,,298,-10800,464461266195841024,0,BIOTECH888,,41,False,"RT @Celgene: Have you heard of multiple #myeloma?  About 81,000 Americans have this #bloodcancer - visit YouTube to learn more http://t.co/…",7.0032406,0,Biotech-Catalyst,2,51,,Celgene,http://twitter.com/biotech888,Jan to May\Blood\Tweets_BloodCancer.csv,,2,None,05/08/14,0,http://twitter.com/biotech888/status/464461266195841024,False,False,Atlantic Time (Canada),False,,biotech888,None,http://twitter.com/BIOTECH888/status/464461266195841024,None,None,469,1399521600.0
en,,myeloma~bloodcancer,,60,-14400,464491274943594497,0,karandis,,289,False,"RT @Celgene: Have you heard of multiple #myeloma?  About 81,000 Americans have this #bloodcancer - visit YouTube to learn more http://t.co/…",7.0032406,0,Kelly Randis,2,19,,Celgene,http://twitter.com/karandis,Jan to May\Blood\Tweets_BloodCancer.csv,,2,None,05/08/14,0,http://twitter.com/karandis/status/464491274943594497,False,True,Eastern Time (US & Canada),False,,karandis,None,http://twitter.com/karandis/status/464491274943594497,None,None,251,1399521600.0
en,Gal with all the right weaponry #BxSci #Terp #Queensfinest #DAWNer Political junkie @StrategyBlue,US~bloodcancer~DonateToday~StrengthAndStyle,,320,-14400,464604018808201219,0,SayWordMel,NYC/ATL,82,False,RT @allyn_lewis: One person in the #US is diagnosed w/ #bloodcancer every 4 mins #DonateToday #StrengthAndStyle http://t.co/Dxb6NCKxpI http…,7.3539653,0,Mellee Mel,7,339,,allyn_lewis,http://twitter.com/saywordmel,Jan to May\Blood\Tweets_BloodCancer.csv,,2,None,05/09/14,4,http://twitter.com/saywordmel/status/464604018808201219,False,True,Eastern Time (US & Canada),False,,saywordmel,None,http://twitter.com/SayWordMel/status/464604018808201219,None,None,2496,1399608000.0
en,"Heme/Onc, Cancer Research. Aurora. Myeloma (#mmsm) , Lymphoma, Phase I/II, Social media. Advise(d): Best Doctors, @Doximity, image32, @XconomyWI",MDS~myelodysplasticsyndrome~bloodcancer,"Time Lab, Rochester, NY 14607, USA",1938,-18000,464770937968427008,3,mtmdphd,Southeastern WI,11529,False,"RT @doctorpemm: Great review article on #MDS in 2014 by Dr Garcia-Manero
http://t.co/IpVRKOEcAp #myelodysplasticsyndrome #bloodcancer @garc…",10.044055,0,"Mike Thompson, MDPhD",5,5902,"(43.1527442, -77.60134339999999)",doctorpemm~garciamanero,http://twitter.com/mtmdphd,Jan to May\Blood\Tweets_BloodCancer.csv,"(42.4949951, -88.324654)",2,None,05/09/14,292,http://twitter.com/mtmdphd/status/464770937968427008,False,True,Central Time (US & Canada),False,"Southeastern Court, Genoa City, WI 53128, USA",mtmdphd,None,http://twitter.com/mtmdphd/status/464770937968427008,None,None,28472,1399608000.0
en,"Pastoral Associate at Saint Patrick Church, Carlisle, PA.  Hobbies are beekeeping, knitting, zumba, reading, movies.  Love opportunities to serve.",survivorsday~flameofhope~bloodcancer~radiationtherapy~chemotherapy,"Nenjiang River, China",101,None,464792659476086784,1,singspiritprais,"Carlisle, PA",2,False,#survivorsday celebration on 6/1 #flameofhope. Free event for those with #bloodcancer #radiationtherapy #chemotherapy http://t.co/VKE6moQEHB,7.054328,1,Mary Moll,0,17,"(48.2575848, 124.7792302)",,http://twitter.com/singspiritprais,Jan to May\Blood\Tweets_BloodCancer.csv,"(40.2025, -77.195)",2,None,05/09/14,0,http://twitter.com/singspiritprais/status/464792659476086784,False,True,None,False,"Carlisle, PA, USA",singspiritprais,None,http://twitter.com/singspiritprais/status/464792659476086784,None,None,74,1399608000.0
en,"volunteer, partner, mother, grandma, Informal educator/learner, mentor, birder, up cycler, finding joy in my world.",bloodcancer,United States,390,-14400,464847463501680640,4,MaryMcProgMgr,Greater Boston Area,2,False,RT @KatieGriffith88: Just called my rep &amp; senators to ask them to support #bloodcancer patients by helping pass 2 key bills. @LLSAdvocacy h…,7.0700836,0,Mary T McIntosh,5,83,"(37.09024, -95.712891)",KatieGriffith88~LLSAdvocacy,http://twitter.com/marymcprogmgr,Jan to May\Blood\Tweets_BloodCancer.csv,"(42.3495635, -71.2285322)",2,None,05/09/14,0,http://twitter.com/marymcprogmgr/status/464847463501680640,False,True,Eastern Time (US & Canada),False,"Greater Boston Chinese Cultural, 437 Cherry Street, Newton, MA 02465, USA",marymcprogmgr,None,http://twitter.com/MaryMcProgMgr/status/464847463501680640,None,None,183,1399608000.0
en,J'ai 19 ans || new south wales || étudiants de I'université ést Chatolic University || fulltime model || @Jshleamaurer || jeaneshlea.maurer@yahoo.co.id,bloodcancer~bighope,"Bangkok, Thailand",425,25200,464934850135195648,-2,Jeaneshlea21,,8,False,Survive from my enemies #bloodcancer #bighope http://t.co/ktZI4AzuRi,8.194731,1,J Maurer,0,104,"(13.7278956, 100.5241235)",,http://twitter.com/jeaneshlea21,Jan to May\Blood\Tweets_BloodCancer.csv,,2,None,05/10/14,0,http://twitter.com/jeaneshlea21/status/464934850135195648,False,False,Bangkok,False,,jeaneshlea21,None,http://twitter.com/Jeaneshlea21/status/464934850135195648,None,None,223,1399694400.0
en,Founded in 2006. Imagine A Cure for Leukemia is a not for profit Registered Charity. We raise money to fund leading edge Leukemia Research.,leukemia~happy~pharellwilliams~happy~hope~bloodcancer,"Nenjiang River, China",1045,None,464964142625849344,0,ACure4Leukemia,Toronto,133,False,10 year old #leukemia patient directs #happy video http://t.co/ZvXUKx5YkA #pharellwilliams #happy #hope #bloodcancer,8.300586,3,ImagineCure4Leukemia,1,486,"(48.2575848, 124.7792302)",,http://twitter.com/acure4leukemia,Jan to May\Blood\Tweets_BloodCancer.csv,"(43.653226, -79.3831843)",2,None,05/10/14,7,http://twitter.com/acure4leukemia/status/464964142625849344,False,False,None,False,"Toronto, ON, Canada",acure4leukemia,None,http://twitter.com/ACure4Leukemia/status/464964142625849344,None,None,597,1399694400.0
en,"Urban Fantasy Author, THE LIGHT WHO SHINES
#UrbanFantasy #Vampires #Paranormal #Romance #Mystery
Love to RT! Please return the favor. https://t.co/iT4KI4m2e7",leukemia~happy~pharellwilliams~happy~hope~bloodcancer,,5285,-14400,464966523678109696,0,Lilo_Abernathy,Smoky Mountains,2851,False,RT @ACure4Leukemia: 10 year old #leukemia patient directs #happy video http://t.co/ZvXUKx5YkA #pharellwilliams #happy #hope #bloodcancer,7.218554,0,Lilo J Abernathy,1,5198,,ACure4Leukemia,http://twitter.com/lilo_abernathy,Jan to May\Blood\Tweets_BloodCancer.csv,,2,None,05/10/14,146,http://twitter.com/lilo_abernathy/status/464966523678109696,False,False,Eastern Time (US & Canada),False,,lilo_abernathy,None,http://twitter.com/Lilo_Abernathy/status/464966523678109696,None,None,44799,1399694400.0
en,DHLN Everywhere ♥| Follow Me :),BloodCancer,,1295,28800,465102934372810752,0,DhlnJyCg,,1886,False,Skype? Acepugee. #BloodCancer,7.8083844,1,DHLN ♥,0,542,,,http://twitter.com/omgitsalp,Jan to May\Blood\Tweets_BloodCancer.csv,,2,None,05/10/14,1,http://twitter.com/omgitsalp/status/465102934372810752,False,True,Beijing,False,,omgitsalp,None,http://twitter.com/OmgItsALP/status/465102934372810752,None,None,11856,1399694400.0
en,"Official colourer-in, maker of pretty things and mum to a very gorgeous little boy.",Bristol~shake4mike~bloodcancer,,620,3600,465191007643242496,4,firedupjo,"Bristol, UK",375,False,@DeleteBC hope you are getting lots of registrations from #Bristol in support of #shake4mike - over 30's are headed your way! #bloodcancer,7.9820104,1,Jo Young,0,298,,DeleteBC,http://twitter.com/firedupjo,Jan to May\Blood\Tweets_BloodCancer.csv,,2,None,05/10/14,12,http://twitter.com/firedupjo/status/465191007643242496,False,True,London,False,,firedupjo,None,http://twitter.com/firedupjo/status/465191007643242496,None,DeleteBC,2002,1399694400.0
en,A stem cell transplant is often the last chance to save the life of a person with blood cancer. Join the bone Marrow register and help SAVE A LIFE.,bonemarrow~marrow~cancer~bloodcancer~hope,,171,None,465448493876670464,-2,ladyzainabtrust,London,9,False,"Nobody became poor by giving... Donate today

#bonemarrow #marrow #cancer #bloodcancer #hope… http://t.co/RYxe1eoetz",8.447266,1,Lady Zainab Trust ,1,83,,,http://twitter.com/ladyzainabtrust,Jan to May\Blood\Tweets_BloodCancer.csv,,2,None,05/11/14,2,http://twitter.com/ladyzainabtrust/status/465448493876670464,False,False,None,False,,ladyzainabtrust,None,http://twitter.com/ladyzainabtrust/status/465448493876670464,None,None,169,1399780800.0
en,"Urban Fantasy Author, THE LIGHT WHO SHINES
#UrbanFantasy #Vampires #Paranormal #Romance #Mystery
Love to RT! Please return the favor. https://t.co/iT4KI4m2e7",bonemarrow~marrow~cancer~bloodcancer~hope,,5285,-14400,465450462796591105,-2,Lilo_Abernathy,Smoky Mountains,2851,False,"RT @ladyzainabtrust: Nobody became poor by giving... Donate today

#bonemarrow #marrow #cancer #bloodcancer #hope… http://t.co/RYxe1eoetz",7.3687215,0,Lilo J Abernathy,1,5198,,ladyzainabtrust,http://twitter.com/lilo_abernathy,Jan to May\Blood\Tweets_BloodCancer.csv,,2,None,05/11/14,146,http://twitter.com/lilo_abernathy/status/465450462796591105,False,False,Eastern Time (US & Canada),False,,lilo_abernathy,None,http://twitter.com/Lilo_Abernathy/status/465450462796591105,None,None,44799,1399780800.0
en,"LLS Mission: Cure leukemia, lymphoma, Hodgkin's disease and myeloma, and improve the quality of life of patients and their families.",bloodcancer,,413,-25200,465477750573502465,2,LLSAZ,"Phoenix, AZ",109,False,Happy Mother's Day! We see a world where no mom has #bloodcancer.,8.352445,1,"LLS, Arizona Chapter",0,429,,,http://twitter.com/llsaz,Jan to May\Blood\Tweets_BloodCancer.csv,,2,None,05/11/14,31,http://twitter.com/llsaz/status/465477750573502465,False,False,Arizona,False,,llsaz,None,http://twitter.com/LLSAZ/status/465477750573502465,None,None,424,1399780800.0
en,"Bromsgrove, Worcestershire of Avoncroft, Sanders Park, Grafton Manor, Artrix, Bromsgrove School, New College, Bromsgrove Rovers & Bromsgrove Rugby Football",Running~Race~Charity~BloodCancer~Bromsgrove~FunRun~Tshirt~Medal~Number,,137,3600,465480553936867328,0,bromsgrove,"Bromsgrove, Worcestershire, UK",1,False,"This Mornings Achievement  
#Running #Race #Charity #BloodCancer #Bromsgrove #FunRun #Tshirt #Medal #Number #... http://t.co/XvaYAKahMr",9.777343,1,Bromsgrove,4,1104,,,http://twitter.com/bromsgrove,Jan to May\Blood\Tweets_BloodCancer.csv,,2,None,05/11/14,13,http://twitter.com/bromsgrove/status/465480553936867328,False,False,London,False,,bromsgrove,None,http://twitter.com/bromsgrove/status/465480553936867328,None,None,34043,1399780800.0
en,"You can win a house for £1.95 - only 250,000 entries are available! - Proudly supporting #Charity - Contact @WinAHome4Life as page not monitored daily - Thanks",Running~Race~Charity~BloodCancer~Bromsgrove~FunRun~Tshirt~Medal~Number,"London, UK",120,3600,465482428967305216,0,_WinAHouse,Email: admin@winnit.co.uk,35,False,"RT @bromsgrove: This Mornings Achievement  
#Running #Race #Charity #BloodCancer #Bromsgrove #FunRun #Tshirt #Medal #Number #... http://t.…",6.9785333,0,Win A House,4,757,"(51.5073509, -0.1277583)",bromsgrove,http://twitter.com/_winahouse,Jan to May\Blood\Tweets_BloodCancer.csv,,2,None,05/11/14,17,http://twitter.com/_winahouse/status/465482428967305216,False,True,London,False,,_winahouse,None,http://twitter.com/_WinAHouse/status/465482428967305216,None,None,49141,1399780800.0
en,"Urban Fantasy Author, THE LIGHT WHO SHINES
#UrbanFantasy #Vampires #Paranormal #Romance #Mystery
Love to RT! Please return the favor. https://t.co/iT4KI4m2e7",Running~Race~Charity~BloodCancer~Bromsgrove~FunRun~Tshirt~Medal~Number,United States,5285,-14400,465482794471522304,0,Lilo_Abernathy,Smoky Mountains,2851,False,"RT @bromsgrove: This Mornings Achievement  
#Running #Race #Charity #BloodCancer #Bromsgrove #FunRun #Tshirt #Medal #Number #... http://t.…",6.9785333,0,Lilo J Abernathy,4,5198,"(37.09024, -95.712891)",bromsgrove,http://twitter.com/lilo_abernathy,Jan to May\Blood\Tweets_BloodCancer.csv,"(35.525521, -83.52630599999999)",2,None,05/11/14,146,http://twitter.com/lilo_abernathy/status/465482794471522304,False,False,Eastern Time (US & Canada),False,"Smoky Mountains, Great Smoky Mountains National Park, Forneys Creek, NC 28713, USA",lilo_abernathy,None,http://twitter.com/Lilo_Abernathy/status/465482794471522304,None,None,44799,1399780800.0
en,"Sabrina Street is a Secondary Teacher in Louisiana. Street aspires to be a writer and is currently seeking representation for her novel, The Vampire Keeper.",Running~Race~Charity~BloodCancer~Bromsgrove~FunRun~Tshirt~Medal~Number,"Nenjiang River, China",3324,None,465483313403428864,0,snstreet,,4233,False,"RT @bromsgrove: This Mornings Achievement  
#Running #Race #Charity #BloodCancer #Bromsgrove #FunRun #Tshirt #Medal #Number #... http://t.…",6.9785333,0,Sabrina Street,4,3333,"(48.2575848, 124.7792302)",bromsgrove,http://twitter.com/snstreet,Jan to May\Blood\Tweets_BloodCancer.csv,,2,None,05/11/14,72,http://twitter.com/snstreet/status/465483313403428864,False,False,None,False,,snstreet,None,http://twitter.com/snstreet/status/465483313403428864,None,None,26328,1399780800.0
en,always running,Running~Race~Charity~BloodCancer~Bromsgrove~FunRun~Tshirt~Medal~Number,"Nenjiang River, China",519,None,465505071246368768,0,runningme1988,"big sur, ca",2123,False,"RT @bromsgrove: This Mornings Achievement  
#Running #Race #Charity #BloodCancer #Bromsgrove #FunRun #Tshirt #Medal #Number #... http://t.…",6.9785333,0,"runner, runner",4,1067,"(48.2575848, 124.7792302)",bromsgrove,http://twitter.com/runningme1988,Jan to May\Blood\Tweets_BloodCancer.csv,"(36.2704212, -121.807976)",2,None,05/11/14,10,http://twitter.com/runningme1988/status/465505071246368768,False,False,None,False,"Big Sur, CA 93920, USA",runningme1988,None,http://twitter.com/runningme1988/status/465505071246368768,None,None,24469,1399780800.0
en,Owner of @relevebyallyn { #UnlockInspiration } + | Blogger | Model | Entrepreneur | Philanthropist | Founder of @LaNuitNoireBall,MWOY~BloodCancer,"Time Lab, Rochester, NY 14607, USA",1663,-10800,465653317222551552,4,allyn_lewis,,89820,False,"HELP! It's the last week of my #MWOY campaign! Please help me reach my $250,000 goal for @LLSWPA! http://t.co/Dxb6NCKxpI #BloodCancer &lt;3",9.8868,4,Allyn Lewis,8,5163,"(43.1527442, -77.60134339999999)",LLSWPA,http://twitter.com/allyn_lewis,Jan to May\Blood\Tweets_BloodCancer.csv,,2,None,05/12/14,107,http://twitter.com/allyn_lewis/status/465653317222551552,False,True,Atlantic Time (Canada),False,,allyn_lewis,None,http://twitter.com/allyn_lewis/status/465653317222551552,None,None,18651,1399867200.0
en,"Music lover & journalist traveling the country this summer documenting music festivals and concerts. 
EnjoysIncubus. 
 http://t.co/AWpJUiXHdu",MWOY~BloodCancer,,962,None,465653578829692928,4,ToriOnTourPgh,,202,False,"RT @allyn_lewis: HELP! It's the last week of my #MWOY campaign! Please help me reach my $250,000 goal for @LLSWPA! http://t.co/Dxb6NCKxpI #…",7.0699706,0,Tori Lee,8,529,,allyn_lewis~LLSWPA,http://twitter.com/toriontourpgh,Jan to May\Blood\Tweets_BloodCancer.csv,,2,None,05/12/14,1,http://twitter.com/toriontourpgh/status/465653578829692928,False,False,None,False,,toriontourpgh,None,http://twitter.com/ToriOnTourPgh/status/465653578829692928,None,None,294,1399867200.0
en,"Public Relations Associate at Pretty Living Pittsburgh proud, born & raised ⭐️",MWOY~BloodCancer,,241,-18000,465653647276511232,4,Brittany_Ann427,Pittsburgh ,482,False,"RT @allyn_lewis: HELP! It's the last week of my #MWOY campaign! Please help me reach my $250,000 goal for @LLSWPA! http://t.co/Dxb6NCKxpI #…",7.0699706,0,Brittany Comer,8,162,,allyn_lewis~LLSWPA,http://twitter.com/brittany_ann427,Jan to May\Blood\Tweets_BloodCancer.csv,,2,None,05/12/14,1,http://twitter.com/brittany_ann427/status/465653647276511232,False,True,Central Time (US & Canada),False,,brittany_ann427,None,http://twitter.com/Brittany_Ann427/status/465653647276511232,None,None,1212,1399867200.0
en,"Person, Poet, blogger, North American",MWOY~BloodCancer,,468,None,465653837102338048,4,poetrybypamela,,206,False,"RT @allyn_lewis: HELP! It's the last week of my #MWOY campaign! Please help me reach my $250,000 goal for @LLSWPA! http://t.co/Dxb6NCKxpI #…",7.0699706,0,Pamela,8,276,,allyn_lewis~LLSWPA,http://twitter.com/poetrybypamela,Jan to May\Blood\Tweets_BloodCancer.csv,,2,None,05/12/14,6,http://twitter.com/poetrybypamela/status/465653837102338048,False,False,None,False,,poetrybypamela,None,http://twitter.com/poetrybypamela/status/465653837102338048,None,None,1507,1399867200.0
